Election_Id,State,State_Code,Party,Won,Leading,Total,Timestamp
2026_RESULTS,West Bengal,S25,Bharatiya Janata Party - BJP,0,190,190,2026-05-04 07:59:40
2026_RESULTS,West Bengal,S25,All India Trinamool Congress - AITC,0,95,95,2026-05-04 07:59:40
2026_RESULTS,West Bengal,S25,Aam Janata Unnayan party - AJUP,0,2,2,2026-05-04 07:59:40
2026_RESULTS,West Bengal,S25,All India Secular Front - AISF,0,2,2,2026-05-04 07:59:40
2026_RESULTS,West Bengal,S25,Communist Party of India (Marxist) - CPI(M),0,1,1,2026-05-04 07:59:40
